Content,Link,Image_URL,Schedule_Date
"Check out this Stationery find! 💖 #littlniss Use code NEWBIE5!","https://tinyurl.com/28or526b","https://i.ebayimg.com/images/g/SbUAAeSwcE5p59OK/s-l225.jpg",
"Check out this Home Decor find! 💖 #littlniss Use code FRESHFIND20!","https://tinyurl.com/28kvrdgw","https://i.ebayimg.com/images/g/iFYAAOSwmtFmm2jC/s-l225.jpg",
"Check out this Professional Bags find! 💖 #littlniss Use code STYLEDEAL20!","https://tinyurl.com/2bn4h69d","https://i.ebayimg.com/images/g/t5cAAeSwoA9pFRBo/s-l225.jpg",
"Check out this Home Decor find! 💖 #littlniss Use code FRESHFIND20!","https://tinyurl.com/2dopwe6y","https://i.ebayimg.com/images/g/rz4AAeSwCbZp~wIK/s-l225.jpg",
"Check out this Tech Gadgets find! 💖 #littlniss Use code SMARTWINS!","https://tinyurl.com/26our9kv","https://i.ebayimg.com/images/g/SIIAAeSwm5Bp7cg8/s-l225.jpg",
"Refresh your space for the new season with our latest embroidered find. ✨ Use code FRESHFIND20 for 20% off your order! 🌿🛋️ #littlniss #bohohomedecor #springrefresh #throwpillows #homestyling #ad","https://tinyurl.com/2bcdo9yd","https://i.ebayimg.com/images/g/LoIAAeSw9zpp-g7R/s-l225.jpg",
"Satisfying squish, elegant aesthetic. 🧊✨ Elevate your desk game with the NeeDoh Nice Cubes. Use code NEWBIE5 for $5 off! 🧊💙🙌 #sensoryfidget #deskdecor #teacherlife #fidgettoys #littlniss #ad","https://tinyurl.com/22btnrpu","https://i.ebayimg.com/images/g/33IAAeSw1Clp-HPe/s-l225.jpg",
"Never run out of power during your lesson plans again. ⚡️ Our new 22.5W fast charger is the ultimate desk companion. Use code SMARTWINS for 20% off! 🔋✨ #littlniss #teacherlife #desksetup #techaccessories #workfromhome #ad","https://tinyurl.com/276qz5sp","https://i.ebayimg.com/images/g/ljEAAeSwiRRoD-WC/s-l225.jpg",
"Organization never looked so chic. ✨ Transform your to-do list into a work of art with our 1230+ sticker collection. Use code NEWBIE5 for $5 off! ☁️📔 #ad

#plannercommunity #aestheticstationery #teacherlife #homeorganization #littlniss","https://tinyurl.com/2a7d9of5","https://i.ebayimg.com/images/g/q~EAAeSwJyRp9SFj/s-l225.jpg",
"Effortless elegance for your daily routine. ✨ Get the perfect drape in seconds with our jeweled instant wraps. Use code STYLEDEAL20 for 20% off at checkout! 💎🧕 #modestfashion #hijabstyle #teacherootd #instantheadwrap #littlniss #ad","https://tinyurl.com/2d7hpwc9","https://i.ebayimg.com/images/g/1rMAAOSw0Idgsi17/s-l225.jpg",
"Playtime, evolved. 🧩 Our Montessori-inspired wooden puzzles help little ones build focus and fine motor skills beautifully. Use code NEWBIE5 for $5 off your order! ✨👶🪵 #littlniss #montessoritoys #woodenpuzzles #toddleractivities #learningthroughplay #ad","https://tinyurl.com/27lqy2bf","https://i.ebayimg.com/images/g/AykAAeSwwSZp90wh/s-l225.jpg",
"Upgrade your desk aesthetic with our personalized whiteboard essentials. Practical, elegant, and perfect for the organized teacher! ✨ Use code NEWBIE5 for $5 off your set. ✏️🤍 #ad #teacherlife #classroomorganization #teacherdesk #personalizedgifts #littlniss","https://tinyurl.com/2xlusuqc","https://i.ebayimg.com/images/g/o8IAAOSwoJ5k1MGX/s-l225.jpg",
"Effortless elegance for your daily routine. ☁️✨ Grab your favorite jersey hijab and use code STYLEDEAL20 for 20% off! #littlniss #modestfashion #hijabstyle #teacherootd #modestwear #ad","https://tinyurl.com/2685zylo","https://i.ebayimg.com/images/g/Wx8AAOSwdB9hpI~a/s-l225.jpg",
"Never run out of battery during a long lesson day again. ⚡️ Sleek, fast-charging, and a total desk essential. Use code SMARTWINS for 20% off! 🔋✨💻 #littlniss #teacherlife #desksetup #techgadgets #homeoffice #ad","https://tinyurl.com/2awe453f","https://i.ebayimg.com/images/g/VE8AAeSwamJp8kFj/s-l225.jpg",
"Bring a touch of calm to your classroom with these elegant eucalyptus borders. ✨ Shop the link in our bio and use code NEWBIE5 for $5 off your order! 🌿🤍 #ad #classroomdecor #bohoclassroom #teacherlife #eucalyptusdecor #littlniss","https://tinyurl.com/2d26rha8","https://i.ebayimg.com/images/g/PQUAAeSwNIpp40iv/s-l225.jpg",
"Say goodbye to wrist strain and hello to effortless desk aesthetics. ✨ Our new ergonomic mouse is the ultimate upgrade for your workspace. Use code NEWBIE5 for $5 off! 🖱️💻 #ad #littlniss #desksetup #teacherlife #homeofficegoals #ergonomic","https://tinyurl.com/25dg5wue","https://i.ebayimg.com/images/g/VJcAAeSwx~hpybMp/s-l225.jpg",
"Found the secret to a perfect hijab day! ☁️ With 82 colors to choose from, our tie-back undercaps are a total wardrobe essential. Use code STYLEDEAL20 for 20% off at checkout! ✨🧕🏼 #ad #littlniss #hijabstyle #modestfashion #undercap #hijabessential","https://tinyurl.com/2xkf84dn","https://i.ebayimg.com/images/g/DO4AAeSwuYZouvIY/s-l225.jpg",
"Ditch the plastic for something chicer. ✨ Keep your produce fresh and your kitchen aesthetic perfectly curated. Shop the set with code FRESHFIND20 for 20% off! 🌿🍯 #ad #sustainableliving #ecokitchen #littlniss #plasticfree #minimalistliving","https://tinyurl.com/2arop9c8","https://i.ebayimg.com/images/g/XawAAOSwDxxmOol8/s-l225.jpg",
"Butter yellow is the moment. 🧈✨ This ruched maxi dress is the ultimate staple for a polished, effortless look. Use code STYLEDEAL20 for 20% off! 🥂 #littlniss #butteryellow #modestfashion #teacherstyle #effortlesschic #ad","https://tinyurl.com/24yaqtve","https://i.ebayimg.com/images/g/pcEAAeSwif9pwEQo/s-l225.jpg",
"Effortless elegance for your daily rotation. This satin print is the perfect accessory to elevate your professional ensemble. ✨👜🕊️ #modestfashion #hijabstyle #teacherootd #satinscarf #littlniss #ad","https://tinyurl.com/2yb6znk4","https://i.ebayimg.com/images/g/rVgAAeSwBrxosSJh/s-l225.jpg",
"Coolest addition to your desk setup yet. 🧊✨🧊 #littlniss #fidgettoys #teacherlife #deskdecor #sensoryplay #ad","https://tinyurl.com/27dgoo9m","https://i.ebayimg.com/images/g/8jkAAeSwjapp~PBr/s-l225.jpg",
"Desk aesthetics meet satisfying sensory relief. The blue Nice Cube is my new favorite way to stay focused during long grading sessions. 🧊✨🧘 #littlniss #desksetup #teacherlife #sensoryfidget #focus #ad","https://tinyurl.com/2be6ee7h","https://i.ebayimg.com/images/g/NVYAAeSwjGFp3S37/s-l225.jpg",
"Organization never looked so chic. ✨ Transform your planner into a masterpiece with 1360+ aesthetic designs tailored for your busy lifestyle. 🗓️🖋️ #littlniss #plannercommunity #teacherlife #aestheticstationery #stationeryaddict #ad","https://tinyurl.com/22ham7k5","https://i.ebayimg.com/images/g/zwIAAeSwHQBp3M~m/s-l225.jpg",
"Grading papers just got a major upgrade. ✨ Elevate your desk aesthetic with the perfect balance of professional precision and luxury style. 🖋️📓 #TeacherStationery #LuxuryPen #DeskGoals #StationeryAddict #littlniss #ad","https://tinyurl.com/2ckumlrf","https://i.ebayimg.com/images/g/v5kAAeSwsV9ps9WY/s-l225.jpg",
"Say goodbye to wrist strain and hello to effortless productivity. Elevate your desk setup with this silent, ergonomic essential. ✨🖱️💼 #littlniss #ergonomicworkspace #minimalistdesk #teacherlife #homeofficeinspo #ad","https://tinyurl.com/2cjopr44","https://i.ebayimg.com/images/g/yuYAAOSwobtn~1Qs/s-l225.jpg",
"Elevate your sanctuary with a touch of botanical velvet. ✨ Sophisticated textures meet boho charm in our favorite new find. 🌿🛋️ #ad #littlniss #homedecor #bohovibes #velvetpillows #curatedhome","https://tinyurl.com/2dl8ka65","https://i.ebayimg.com/images/g/v4wAAeSwCRdpdV4n/s-l225.jpg",
"Never let your phone die during a busy day of teaching or curating. This sleek power bank is the ultimate essential for your bag! ⚡️📱✨ #littlniss #techaccessories #teacherlife #homecurator #fastcharging #ad","https://tinyurl.com/22pjt9eh","https://i.ebayimg.com/images/g/rygAAeSwxVRpQ6ZC/s-l225.jpg",
"Elevate playtime with intentional, Montessori-inspired wooden puzzles. Simple, beautiful, and perfect for curious little minds. 🧩✨🧸 #littlniss #MontessoriToys #EducationalPlay #ToddlerActivities #MindfulParenting #ad","https://tinyurl.com/27gsfct8","https://i.ebayimg.com/images/g/VMUAAeSwQAFp~5NQ/s-l225.jpg",
"Elevate your desk game with 850+ reasons to stay organized. ✨ Minimalist, chic, and ready for your planner. 📖🖋️ #littlniss #planneraddict #stationerylove #teacherlife #aestheticdesk #ad","https://tinyurl.com/288zxpqu","https://i.ebayimg.com/images/g/7ccAAeSwXUhpbiUY/s-l225.jpg",
"Bring a touch of calm to your classroom with these elegant eucalyptus borders. Minimalist vibes for maximum inspiration. 🌿✨🏫 #bohoclassroom #classroomdecor #teacherstyle #eucalyptusdecor #littlniss #ad","https://tinyurl.com/2bulz42t","https://i.ebayimg.com/images/g/drUAAeSwEgNpRNgQ/s-l225.jpg",
"Say goodbye to wrist fatigue and hello to your new desk essential. ☁️💻✨ Functional, chic, and whisper-quiet. #littlniss #ergonomicdesk #teacherlife #homeofficeideas #techstyle #ad","https://tinyurl.com/27m6l4my","https://i.ebayimg.com/images/g/lcUAAeSwXKVpIR03/s-l225.jpg",
"Writing in style is a professional superpower. ✨ This Montblanc set is the ultimate desk upgrade for the modern educator. 🖋️💼 #littlniss #teacherlife #montblanc #stationeryaddict #professionalstyle #ad","https://tinyurl.com/229usbhz","https://i.ebayimg.com/images/g/ZAsAAeSwWi9p-aDt/s-l225.jpg",
"Elevate your nook with the perfect mix of texture and tone. This boho-inspired chevron detail is the subtle upgrade your space deserves. ✨🌿🤍 #homedecor #bohostyle #interiordesign #littlniss #minimalistdecor #ad","https://tinyurl.com/2b2kmou6","https://i.ebayimg.com/images/g/mCkAAeSwVNVp~uyk/s-l225.jpg",
"Eco-friendly living never looked so elegant. ✨ Keep your sourdough fresh and your lunch plastic-free with these organic beeswax staples. 🍯🍞🌿 #sustainableliving #ecokitchen #littlniss #plasticfree #homeessentials #ad","https://tinyurl.com/234fqgsn","https://i.ebayimg.com/images/g/0pMAAeSwPCtpwPdT/s-l225.jpg",
"Never let your phone die mid-lesson again. 🌸 Power, elegance, and speed all in one compact device. ✨ Stay charged beautifully! 🔋 #TeacherLife #TechEssentials #RoseGoldVibes #DeskGoals #SmallBizLove #ad","https://tinyurl.com/2b3wprpo","https://i.ebayimg.com/images/g/fHgAAeSwpHRp2-8l/s-l225.jpg",
"Effortless elegance for the modern educator. ✨ Elevate your daily look with our new gradient chiffon series. Classy, breathable, and perfectly curated for you. ☁️🕊️ #ModestFashion #TeacherStyle #HijabFashion #MinimalistStyle #LittlnissStyle #ad","https://tinyurl.com/23kkvvaw","https://i.ebayimg.com/images/g/c0gAAeSwkC1pFXU5/s-l225.jpg",
"From the classroom to the coffee shop, stay effortlessly organized. 💼✨ Elevate your daily carry with a bag that does it all. #TeacherStyle #WorkBagEssentials #LeatherTote #OfficeChic #littlniss #ad","https://tinyurl.com/2a4o7ak8","https://i.ebayimg.com/images/g/WSIAAeSwYw9pGB-R/s-l225.jpg",
